{
  "id": "budget_019c0000000070008000000000000003",
  "workspace": "research-team",
  "limit": {
    "requests": 10,
    "input_tokens": 10000,
    "output_tokens": 5000,
    "cost_micros": 50000
  },
  "starts_at": "2026-08-21T08:59:00Z",
  "expires_at": "2026-08-21T10:00:00Z",
  "resource_version": "rv1:1:sha256:cccccccccccccccccccccccccccccccccccccccccccccccccccccccccccccccc"
}
